{
  "$schema": "https://json-schema.org/draft/2020-12/schema",
  "title": "Forecast",
  "description": "Forecast of weekly cases for a geography and target week.",
  "type": "object",
  "properties": {
    "geography": {
      "$ref": "#/$defs/GeoId"
    },
    "origin_week": {
      "description": "Last week of data the forecast was allowed to use (the forecast date).",
      "$ref": "#/$defs/MmwrWeek"
    },
    "provenance": {
      "$ref": "#/$defs/Provenances"
    },
    "quantiles": {
      "description": "Quantiles with strictly increasing levels and non-decreasing values; never empty.",
      "type": "array",
      "items": {
        "$ref": "#/$defs/ForecastQuantile"
      }
    },
    "run_count": {
      "description": "Number of ensemble members behind the quantiles.",
      "type": "integer",
      "format": "uint32",
      "minimum": 0
    },
    "seed": {
      "description": "Seed of the stochastic run that produced the ensemble.",
      "type": "integer",
      "format": "uint64",
      "minimum": 0
    },
    "target_week": {
      "description": "Week being predicted; strictly after `origin_week`.",
      "$ref": "#/$defs/MmwrWeek"
    }
  },
  "additionalProperties": false,
  "required": [
    "geography",
    "origin_week",
    "target_week",
    "quantiles",
    "seed",
    "run_count",
    "provenance"
  ],
  "$defs": {
    "ForecastQuantile": {
      "description": "One quantile of a forecast predictive distribution.",
      "type": "object",
      "properties": {
        "level": {
          "description": "Quantile level in (0, 1), e.g. 0.05, 0.5, 0.95.",
          "type": "number",
          "format": "double",
          "maximum": 1,
          "minimum": 0
        },
        "value": {
          "description": "Predicted weekly case count at that quantile (non-negative).",
          "type": "number",
          "format": "double"
        }
      },
      "additionalProperties": false,
      "required": [
        "level",
        "value"
      ]
    },
    "GeoId": {
      "description": "Geography key: state FIPS (2 digits) or county FIPS (5 digits), zero-padded",
      "type": "string",
      "pattern": "^((0[1-9]|[1-9][0-9])|(0[1-9]|[1-9][0-9])(00[1-9]|0[1-9][0-9]|[1-9][0-9]{2}))$"
    },
    "MmwrWeek": {
      "description": "An MMWR year and week number (`week` is `1..=52` or `1..=53`).",
      "type": "object",
      "properties": {
        "week": {
          "description": "Week of the MMWR year; 1 to 52, or 53 in a 53-week year.",
          "type": "integer",
          "format": "uint8",
          "maximum": 53,
          "minimum": 1
        },
        "year": {
          "description": "MMWR year (not always the calendar year of every day in the week).",
          "type": "integer",
          "format": "uint16",
          "maximum": 2200,
          "minimum": 1900
        }
      },
      "additionalProperties": false,
      "required": [
        "year",
        "week"
      ]
    },
    "Provenance": {
      "description": "Where a number came from: the immutable snapshot, its source URL and when it was retrieved.",
      "type": "object",
      "properties": {
        "licence_id": {
          "description": "Id of the source's licence or terms as listed in `SOURCES.md`.",
          "type": "string"
        },
        "retrieved_at": {
          "description": "Retrieval time, RFC 3339 in UTC (e.g. `2026-09-30T12:00:00Z`).",
          "type": "string",
          "format": "date-time"
        },
        "sha256": {
          "description": "Content address of the raw snapshot bytes.",
          "$ref": "#/$defs/Sha256Hex"
        },
        "source_id": {
          "description": "Stable id of the source as listed in `SOURCES.md` (e.g. `cdc-measles-weekly`).",
          "type": "string"
        },
        "url": {
          "description": "URL the snapshot was retrieved from.",
          "type": "string"
        }
      },
      "additionalProperties": false,
      "required": [
        "source_id",
        "url",
        "retrieved_at",
        "sha256",
        "licence_id"
      ]
    },
    "Provenances": {
      "type": "array",
      "items": {
        "$ref": "#/$defs/Provenance"
      },
      "minItems": 1
    },
    "Sha256Hex": {
      "description": "SHA-256 digest, 64 lowercase hex characters",
      "type": "string",
      "pattern": "^[0-9a-f]{64}$"
    }
  }
}
